{
  "appworld_imported": false,
  "bundle_count": 2,
  "checks": {
    "all_frozen_input_hashes_match": true,
    "all_remote_checks_passed": true,
    "five_result_freeze_tests_pass": true,
    "freeze_schema_is_closed": true,
    "freeze_value_matches_closed_schema_fields": true,
    "member_count_total_and_manifest_recompute": true,
    "member_paths_are_sorted_unique_and_safe": true,
    "no_install_task_model_or_gpu_boundary_crossed": true,
    "remote_project_revision_matches": true,
    "remote_result_bytes_and_hash_match": true,
    "remote_result_matches_closed_top_level_schema": true,
    "rerun_install_model_and_claim_gates_closed": true,
    "two_encrypted_bundle_records_match": true,
    "wheel_identity_and_counts_match": true
  },
  "confirmatory_claim_authorized": false,
  "controlled_install_protocol_design_authorized": true,
  "freeze_config_sha256": "df6858cbedadf0f88c5b35d0b07e7dce138ea11f6d456d100e9e4f25ac93cfb1",
  "gpu_used": false,
  "member_count": 44,
  "member_manifest_sha256": "65c1229057d82899d55f435e38b01ac62c037703f4b441dec44c6a2d5918aead",
  "model_loaded": false,
  "model_run_authorized": false,
  "next_gate": "design_controlled_install_and_static_api_inventory_protocol",
  "passed": true,
  "protected_bundle_opened": false,
  "remote_project_revision": "cc297f055b0439ed32c89cc18974a066eba10de5",
  "remote_result_sha256": "2390843c1ede6839a3b9eae350d21c5ae6c0e7bbed09db068d7a87adf6454037",
  "run_kind": "proper_v2_3_appworld_wheel_inventory_result_freeze",
  "schema_version": 1,
  "scientific_stage_passed": false,
  "source_install_authorized": false,
  "task_or_api_data_read": false,
  "wheel_extracted": false,
  "wheel_inventory_rerun_authorized": false
}
